{
  "$schema": "https://json-schema.org/draft/2020-12/schema",
  "$id": "https://local/zflip5-modem-module/config.schema.json",
  "title": "zflip5-modem-module daemon config",
  "type": "object",
  "additionalProperties": false,
  "required": ["bind_host", "bind_port", "tokens", "thermal", "rate_limits"],
  "$comment": "cpu, hotspot, and quota are written by the first-boot template and/or persisted by the daemon; they are optional so older configs still validate.",
  "properties": {
    "bind_host": {
      "type": "string",
      "default": "127.0.0.1",
      "description": "api-front listen address. Loopback-only. The pattern rejects any all-interfaces / public bind.",
      "pattern": "^(127\\.0\\.0\\.1|::1|localhost)$"
    },
    "bind_port": { "type": "integer", "minimum": 1024, "maximum": 65535, "default": 18080 },
    "tokens": {
      "type": "object",
      "description": "Scoped, independently revocable bearer tokens (>=256-bit -> >=64 hex chars). Generated at first boot, 0600 under /data/adb.",
      "additionalProperties": false,
      "required": ["read-status"],
      "properties": {
        "read-status": { "$ref": "#/$defs/token" },
        "radio-control": { "$ref": "#/$defs/token" }
      }
    },
    "thermal": {
      "type": "object",
      "additionalProperties": false,
      "required": ["warn_c", "gate_c", "fail_closed"],
      "properties": {
        "warn_c": { "type": "number", "minimum": 30, "default": 44, "description": "Owner-adjustable warn threshold (floor 30C, must stay below gate_c). Clamped by the daemon on load and on every retune." },
        "gate_c": { "type": "number", "minimum": 31, "maximum": 48, "description": "Above this (battery temp or hottest sysfs zone) radio/tether writes are refused. Hard-capped at 48C: the gate can be retuned but never disabled." },
        "fail_closed": { "type": "boolean", "const": true, "description": "If thermal cannot be read, treat as unsafe. PRIMARY source is battery temp + /sys/class/thermal; Android status is advisory." },
        "bench": { "type": "boolean", "default": false, "description": "Explicit opt-in for battery-less donor hardware on a bench supply: disables thermal zones/cooling and lifts Samsung kernel cpufreq_limit + app gate to 70C. Vendor thermal HALs stay running (system_server needs them); the 5s watchdog wins the tug-of-war. Critical trip at 70C restores mitigation. Off by default." }
      }
    },
    "cpu": {
      "type": "object",
      "additionalProperties": false,
      "description": "Reversible CPU power/perf policy. Only ever reduces when hot; never offlines the little cluster (cpu0-2).",
      "properties": {
        "mode": { "type": "string", "enum": ["auto", "performance", "balanced", "eco", "off"], "default": "auto" }
      }
    },
    "hotspot": {
      "type": "object",
      "additionalProperties": false,
      "description": "Data-sharing Wi-Fi hotspot behavior.",
      "properties": {
        "dual_band": { "type": "boolean", "default": false },
        "enable_on_boot": { "type": "boolean", "default": true, "description": "Bring the hotspot up at boot from the saved SoftAP config." },
        "ssid_whitelist": { "type": "array", "items": { "type": "string", "maxLength": 32 }, "maxItems": 16, "default": [], "description": "Auto-toggle: hotspot turns OFF when any listed SSID is scanned nearby, back ON when none is seen. Empty disables the feature." }
      }
    },
    "quota": {
      "type": "object",
      "additionalProperties": false,
      "description": "Data-cap meter: a limit to show progress against, and a reset schedule. Meter only — nothing gates the hotspot, radio, or CPU on it. Absent/zero-value means unconfigured, and the dashboard prompts the owner to pick a plan.",
      "properties": {
        "limit_bytes": { "type": "integer", "minimum": 0, "default": 0, "description": "Bytes per period. 0 = no limit configured (panel shows a first-run prompt)." },
        "period": { "type": "string", "enum": ["daily", "weekly", "monthly", "manual"], "default": "monthly", "description": "Reset cadence. weekly always resets Monday (matches week_bytes); manual never resets on its own." },
        "reset_time": { "type": "string", "pattern": "^([01][0-9]|2[0-3]):[0-5][0-9]$", "default": "00:00", "description": "Device-local time of day the period resets, HH:MM." },
        "reset_day": { "type": "integer", "minimum": 1, "maximum": 28, "default": 1, "description": "Day of month the period resets (monthly only). Capped at 28 so every month has that day." }
      }
    },
    "rate_limits": {
      "type": "object",
      "additionalProperties": false,
      "required": ["default_per_min"],
      "properties": {
        "default_per_min": { "type": "integer", "minimum": 1, "default": 600 },
        "radio_per_min": { "type": "integer", "minimum": 1, "default": 60 }
      }
    }
  },
  "$defs": {
    "token": { "type": "string", "pattern": "^[0-9a-fA-F]{64,}$", "description": ">=256-bit hex secret" }
  }
}
