{
  "bind_host": "127.0.0.1",
  "bind_port": 18080,
  "tokens": {
    "read-status": "aaaaaaaaaaaaaaaaaaaaaaaaaaaaaaaaaaaaaaaaaaaaaaaaaaaaaaaaaaaaaaaa",
    "radio-control": "cccccccccccccccccccccccccccccccccccccccccccccccccccccccccccccccc"
  },
  "thermal": { "warn_c": 44, "gate_c": 46, "fail_closed": true },
  "rate_limits": { "default_per_min": 30, "radio_per_min": 6 }
}
